[
  {
    "id": "pn27-4",
    "title": "Registration Open",
    "date": "2026-11-06",
    "time": "09:00",
    "speaker_ids": []
  },
  {
    "id": "pn27-5",
    "title": "Welcome - Ben",
    "date": "2026-11-06",
    "time": "09:30",
    "speaker_ids": [
      "benthemeek"
    ],
    "end_time": "10:00"
  },
  {
    "id": "pn27-6",
    "title": "Welcome to PhreakNET",
    "date": "2026-11-06",
    "time": "10:00",
    "speaker_ids": [
      "nsakey"
    ],
    "end_time": "10:20",
    "description": "<p>For the sake of getting as much info to as many attendees as early as possible, we&#x27;ve brought Welcome to PhreakNET back. This talk will have all the info you&#x27;ll need about the con network and the services running on it, as well as getting connected or connecting your own services. If you miss the talk due to pre-gaming on Thursday night, you&#x27;ll be able to get most of what you need from https://phreaknet.info.</p>"
  },
  {
    "id": "pn27-7",
    "title": "A Practitioner’s Guide to Prompt Engineering",
    "date": "2026-11-06",
    "time": "10:30",
    "speaker_ids": [
      "munano"
    ],
    "end_time": "11:20",
    "description": "<p>Generative AI is quickly becoming part of everyday security work, but I’ve found that getting useful, consistent results takes more than simply asking a question and hoping for the best.</p><p>In this session, I’ll walk through a practical approach to prompt engineering for security practitioners. I’ll cover how I think about writing effective instructions, providing the right context, breaking complex tasks into manageable steps, and deciding when a simple workflow is enough versus when an AI agent may actually make sense.</p><p>I’ll also share security-focused examples, common mistakes that can make AI outputs unreliable or overly complicated, and some of the lessons I’ve learned from building and refining AI-assisted workflows.</p><p>My goal is for attendees to leave with practical techniques they can apply immediately, along with a better framework for using AI effectively while keeping human judgment and validation at the center of the process.</p>"
  },
  {
    "id": "pn27-9",
    "title": "Shelf Label 2: Electric Badge-a-loo",
    "date": "2026-11-06",
    "time": "11:30",
    "speaker_ids": [
      "tyler-crumpton"
    ],
    "end_time": "11:50",
    "description": "<p>Built on the same recycled hardware as PN26&#x27;s, this year&#x27;s PhreakNIC badge got some sweet upgrades! Come learn about the electronic shelf labels that retired from their day jobs to pursue a life of conference customization, wireless communication, and battery-less operation. We&#x27;ll go over some of the basics of how the badges work, as well as all the nifty new stuff added this year.</p>"
  },
  {
    "id": "pn27-10",
    "title": "LUNCH",
    "date": "2026-11-06",
    "time": "12:00",
    "speaker_ids": [],
    "end_time": "13:00"
  },
  {
    "id": "pn27-12",
    "title": "Do You Want to Build a Snowman^W Blinky Badge?",
    "date": "2026-11-06",
    "time": "13:00",
    "speaker_ids": [
      "mlp"
    ],
    "end_time": "13:50",
    "description": "<p>Do you have an idea for illuminated wearable bling but you&#x27;re not sure how to translate the idea into physical reality?<br>Even if you&#x27;ve never lifted a soldering iron in anger; couldn&#x27;t identify a surface mount resistor if you stood on one; or wouldn&#x27;t know a schematic diagram from a datasheet; resources, tools, and services are available to help you make your own Thing without paying extortionate moneys. You can also (for now) remain free of AI slop if you wish.</p><p>During this session we will walk through the necessary steps to design and build (or, have someone build for you) a Blinky Badge, including<br>- form factors (badge vs SAO)<br>- PCB art constraints (limited layers vs full-color)<br>- simple sample circuits<br>- types of component (what they do, what they look like, what their limitations are)<br>- how to plagiarize^W embrace-and-extend existing designs<br>- software tools (local vs online)<br>- suppliers<br>- just how much $ does it cost?</p>"
  },
  {
    "id": "pn27-14",
    "title": "Ham Radio, Digital Modes and Other Fun Stuff!",
    "date": "2026-11-06",
    "time": "14:00",
    "speaker_ids": [
      "crazyhick"
    ],
    "end_time": "14:50",
    "description": "<p>Ham Radio, Digital modes and other fun stuff!</p>"
  },
  {
    "id": "pn27-16",
    "title": "I Can't Believe It's Not Malware!",
    "date": "2026-11-06",
    "time": "15:00",
    "speaker_ids": [
      "altk3y"
    ],
    "end_time": "15:50",
    "description": "<p>A deep dive into the suspicious, the malicious, and the straight-up baffling engineering found in Altk3y&#x27;s drunken online tech purchases. We’ll separate actual supply-chain nightmares from standard factory laziness by dissecting the software and hardware quirks of obscure devices that no sane person should care about. Grab that CH341A and your favorite credit card and get ready to make some questionable life decisions!</p><p>(Watchlist status not included but available for an additional fee.)</p>"
  },
  {
    "id": "pn27-18",
    "title": "From Hunted to Hunter",
    "date": "2026-11-06",
    "time": "16:00",
    "speaker_ids": [
      "tipsybacchus"
    ],
    "end_time": "16:50",
    "description": "<p>From Hunted to Hunter - One of the biggest parts of our jobs in security, is OSINT or Open Source Intelligence. When it comes to searching up information on malware or searching up a coworkers weird facebook page. It is a needed skill with a particular mindset. I plan to show you how to get good at doing these searches may it be people, companies, websites, documents and Threat Actors. By the end of the talk, you will know something you didn&#x27;t or at least you will have some fun.</p>"
  },
  {
    "id": "pn27-20",
    "title": "Abusing Porn Domains for Fun and Profit",
    "date": "2026-11-06",
    "time": "17:00",
    "speaker_ids": [
      "cmex"
    ],
    "end_time": "17:20",
    "description": "<p>Have you ever set up a wildcard email address or DNS entry for a domain you own? Find out what happens when you register an adult business, purchase some .xxx domains, and do the same. (Talk is SFW).</p>"
  },
  {
    "id": "pn27-21",
    "title": "DINNER",
    "date": "2026-11-06",
    "time": "17:30",
    "speaker_ids": [],
    "end_time": "19:00"
  },
  {
    "id": "pn27-24",
    "title": "ESP-NOW: Wireless for Microcontrollers, Minus the Router",
    "date": "2026-11-06",
    "time": "19:00",
    "speaker_ids": [
      "matt-varian"
    ],
    "end_time": "19:20",
    "description": "<p>A practical, tour of ESP-NOW: Espressif’s no-AP, protocol for getting packets between ESP chips before DHCP finishes booting. Check out the technology behind this years *non-infringing PhreakNIC Game Show* buzzers.</p>"
  },
  {
    "id": "pn27-25",
    "title": "Show Me Your Weiner",
    "date": "2026-11-06",
    "time": "19:30",
    "speaker_ids": [
      "itsamenathan"
    ],
    "end_time": "19:50",
    "description": "<p>I ran a HotDog competition for about year, I will share the results and give out a trophy</p>"
  },
  {
    "id": "pn27-26",
    "title": "The Singularity of Light: Or, Why the Dark Panopticon Dictates but Does Not Read",
    "date": "2026-11-06",
    "time": "20:00",
    "speaker_ids": [
      "mog"
    ],
    "end_time": "20:50",
    "description": "<p>The Singularity of Light: Or, Why the Dark Panopticon Dictates but Does Not Read</p>"
  },
  {
    "id": "pn27-28",
    "title": "Board Games / Hangout",
    "date": "2026-11-06",
    "time": "21:00",
    "speaker_ids": []
  },
  {
    "id": "pn27-30",
    "title": "Registration Open",
    "date": "2026-11-07",
    "time": "09:00",
    "speaker_ids": []
  },
  {
    "id": "pn27-32",
    "title": "I’m gonna give some war-stories.",
    "date": "2026-11-07",
    "time": "10:00",
    "speaker_ids": [
      "lys"
    ],
    "end_time": "10:50",
    "description": "<p>I’m gonna give some war-stories. Mostly talking about some incredible bullshit ive seen over the many ransomware engagements ive ran. I want to talk about how the threat actors have fucked up, how I’ve abused those fuck ups, and how we can deal with extortionware going forward.</p>"
  },
  {
    "id": "pn27-34",
    "title": "The First Computer - and the Nature of Innovation",
    "date": "2026-11-07",
    "time": "11:00",
    "speaker_ids": [
      "crashcart"
    ],
    "end_time": "11:50",
    "description": "<p>Computers are ubiquitous today, but there is an origin. A spark of innovation that lit the fires of industry and thought. Singular geniuses building with sweat and toil to create the first computer. This history helps frame how we got where we are today. Come hear CrashCart tell you some stories he probably read on Wikipedia.</p>"
  },
  {
    "id": "pn27-36",
    "title": "LUNCH",
    "date": "2026-11-07",
    "time": "12:00",
    "speaker_ids": [],
    "end_time": "13:00"
  },
  {
    "id": "pn27-38",
    "title": "Strategies for the Post-LLM Job Market",
    "date": "2026-11-07",
    "time": "13:00",
    "speaker_ids": [
      "nuvious"
    ],
    "end_time": "13:50",